[
  {
    "id": "UX-KRDS-1.1",
    "category": "uiux",
    "section": "공공 브랜딩",
    "principle": "공공 웹 서비스 신뢰·식별",
    "title": "공식 전자정부 누리집 표시",
    "description": "대한민국 공식 전자정부 누리집 안내 또는 동등한 공공 서비스 식별 표시가 있는지 확인",
    "automatable": "semi",
    "severity_default": "warning",
    "runtime_checks": ["gov_official_banner"],
    "static_checks": [],
    "kwcag_map": [],
    "krds_ref": "KRDS · 공공 UI 식별",
    "ref_url": "https://www.krds.go.kr/html/site/component/component_02_01.html",
    "ref_anchor": "tabpanelInfo01",
    "ref_fallback_url": "https://www.krds.go.kr/html/site/component/component_summary.html",
    "fix_hint": "KRDS 가이드에 따른 공식 누리집 안내 배너·문구를 헤더 상단 또는 푸터에 배치하세요.",
    "guideline_version": "2025.08"
  },
  {
    "id": "UX-KRDS-1.2",
    "category": "uiux",
    "section": "KRDS 컴포넌트",
    "principle": "접근·탐색",
    "title": "본문 바로가기(건너뛰기) 링크",
    "description": "키보드 사용자가 반복 영역을 건너뛰고 본문으로 이동할 수 있는 링크 제공",
    "automatable": "auto",
    "severity_default": "error",
    "runtime_checks": ["skip_link"],
    "static_checks": ["skip_link_markup"],
    "kwcag_map": ["6.4.1"],
    "krds_ref": "KRDS · 건너뛰기 링크",
    "ref_url": "https://www.krds.go.kr/html/site/component/component_03_01.html",
    "ref_anchor": "tabpanelInfo01",
    "ref_fallback_url": "https://www.krds.go.kr/html/site/component/component_summary.html",
    "fix_hint": "페이지 최상단에 '본문 바로가기' 링크를 추가하고 #main 또는 #contents 로 이동시키세요.",
    "guideline_version": "2025.08"
  },
  {
    "id": "UX-KRDS-2.1",
    "category": "uiux",
    "section": "KRDS 컴포넌트",
    "principle": "일관된 내비게이션",
    "title": "헤더·GNB 구조",
    "description": "KRDS 헤더/GNB 패턴 또는 동등한 전역 내비게이션 구조 사용",
    "automatable": "semi",
    "severity_default": "warning",
    "runtime_checks": ["header_gnb_structure"],
    "static_checks": ["krds_header_markup"],
    "kwcag_map": [],
    "krds_ref": "KRDS · Header · GNB",
    "ref_url": "https://www.krds.go.kr/html/site/component/component_02_03.html",
    "ref_anchor": "tabpanelInfo01",
    "ref_fallback_url": "https://www.krds.go.kr/html/site/component/component_summary.html",
    "fix_hint": "KRDS Header 컴포넌트 또는 role=banner + nav landmark 구조를 적용하세요.",
    "guideline_version": "2025.08"
  },
  {
    "id": "UX-KRDS-2.2",
    "category": "uiux",
    "section": "KRDS 컴포넌트",
    "principle": "일관된 푸터",
    "title": "푸터·연락처·저작권 영역",
    "description": "KRDS Footer 패턴 — 연락처, 정책 링크, 저작권 표시",
    "automatable": "semi",
    "severity_default": "warning",
    "runtime_checks": ["footer_structure"],
    "static_checks": [],
    "kwcag_map": [],
    "krds_ref": "KRDS · Footer",
    "ref_url": "https://www.krds.go.kr/html/site/component/component_02_04.html",
    "ref_anchor": "tabpanelInfo01",
    "ref_fallback_url": "https://www.krds.go.kr/html/site/component/component_summary.html",
    "fix_hint": "footer[role=contentinfo] 또는 .krds-footer 에 연락처·정책·저작권을 포함하세요.",
    "guideline_version": "2025.08"
  },
  {
    "id": "UX-KRDS-2.3",
    "category": "uiux",
    "section": "KRDS 컴포넌트",
    "principle": "경로 안내",
    "title": "페이지 제목·브레드크럼",
    "description": "현재 위치를 알 수 있는 페이지 제목(h1) 또는 breadcrumb 제공",
    "automatable": "semi",
    "severity_default": "warning",
    "runtime_checks": ["page_title_breadcrumb"],
    "static_checks": [],
    "kwcag_map": ["6.4.2"],
    "krds_ref": "KRDS · Breadcrumb · Title",
    "ref_url": "https://www.krds.go.kr/html/site/component/component_03_03.html",
    "ref_anchor": "tabpanelInfo01",
    "ref_fallback_url": "https://www.krds.go.kr/html/site/component/component_summary.html",
    "fix_hint": "화면별 h1과 KRDS Breadcrumb 컴포넌트로 경로를 표시하세요.",
    "guideline_version": "2025.08"
  },
  {
    "id": "UX-KRDS-3.1",
    "category": "uiux",
    "section": "디자인 토큰",
    "principle": "KRDS 디자인 시스템",
    "title": "KRDS 디자인 토큰(CSS 변수) 사용",
    "description": "색상·타이포·간격 등 KRDS design token(--krds-*) 적용 여부",
    "automatable": "semi",
    "severity_default": "info",
    "runtime_checks": ["krds_design_tokens"],
    "static_checks": ["krds_token_import"],
    "kwcag_map": [],
    "krds_ref": "KRDS · Design Token",
    "ref_url": "https://www.krds.go.kr/html/site/style/style_07.html",
    "ref_fallback_url": "https://www.krds.go.kr/html/site/style/style_01.html",
    "fix_hint": "KRDS CSS/SCSS 토큰을 import하고 하드코딩 색상·간격을 토큰으로 교체하세요.",
    "guideline_version": "2025.08"
  },
  {
    "id": "UX-KRDS-3.2",
    "category": "uiux",
    "section": "KRDS 컴포넌트",
    "principle": "컴포넌트 일관성",
    "title": "KRDS UI 컴포넌트 클래스",
    "description": "버튼·입력·모달 등 KRDS 컴포넌트 클래스(krds-*) 사용",
    "automatable": "semi",
    "severity_default": "info",
    "runtime_checks": ["krds_component_classes"],
    "static_checks": ["krds_class_in_source"],
    "kwcag_map": [],
    "krds_ref": "KRDS · Components",
    "ref_url": "https://www.krds.go.kr/html/site/component/component_summary.html",
    "ref_fallback_url": "https://www.krds.go.kr/html/site/component/component_summary.html",
    "fix_hint": "커스텀 버튼/입력 대신 KRDS Button, Input 등 공통 컴포넌트를 사용하세요.",
    "guideline_version": "2025.08"
  },
  {
    "id": "UX-KRDS-4.1",
    "category": "uiux",
    "section": "포용·설정",
    "principle": "디지털 포용",
    "title": "글자·화면 표시 설정",
    "description": "글자 크기·화면 모드(밝/어두) 조절 UI 제공 (공공 서비스 권장)",
    "automatable": "semi",
    "severity_default": "warning",
    "runtime_checks": ["text_display_settings"],
    "static_checks": [],
    "kwcag_map": [],
    "krds_ref": "KRDS · 글자·화면 설정",
    "ref_url": "https://www.krds.go.kr/html/site/style/style_01.html",
    "ref_text": "선명한 화면 모드",
    "ref_fallback_url": "https://www.krds.go.kr/html/site/style/style_01.html",
    "fix_hint": "헤더에 '글자·화면 설정' 트리거와 KRDS Display Settings 패턴을 적용하세요.",
    "guideline_version": "2025.08"
  },
  {
    "id": "UX-KRDS-5.1",
    "category": "uiux",
    "section": "UX 패턴",
    "principle": "사용자 피드백",
    "title": "오류·안내 메시지 패턴",
    "description": "입력 오류·시스템 오류 시 KRDS Alert/Feedback 패턴으로 명확히 안내",
    "automatable": "manual",
    "severity_default": "info",
    "runtime_checks": [],
    "static_checks": [],
    "kwcag_map": ["7.3.2"],
    "krds_ref": "KRDS · Feedback · 오류",
    "ref_url": "https://www.krds.go.kr/html/site/global/global_07.html",
    "ref_fallback_url": "https://www.krds.go.kr/html/site/global/global_01.html",
    "fix_hint": "오류 상태 화면을 시나리오에 포함하고 Alert/Help text 패턴을 수동 점검하세요.",
    "review_state_ids": ["login_form"],
    "review_hint": "로그인·입력 폼이 있는 화면(예: login_form) 또는 오류 메시지가 표시되는 화면에서 Alert/Feedback 패턴을 확인하세요.",
    "guideline_version": "2025.08"
  },
  {
    "id": "UX-KRDS-5.2",
    "category": "uiux",
    "section": "서비스 패턴",
    "principle": "신청·동의",
    "title": "동의·신청 플로우 UX",
    "description": "개인정보 동의, 신청 단계, 확인·취소 흐름이 가이드 서비스 패턴과 일치하는지",
    "automatable": "manual",
    "severity_default": "info",
    "runtime_checks": [],
    "static_checks": [],
    "kwcag_map": [],
    "krds_ref": "KRDS · Service Pattern · 신청/동의",
    "ref_url": "https://www.krds.go.kr/html/site/service/service_04_06.html",
    "ref_fallback_url": "https://www.krds.go.kr/html/site/service/service_04_01.html",
    "fix_hint": "동의·신청·확인 화면을 frozen 시나리오에 포함하고 체크리스트로 검수하세요.",
    "review_state_ids": [],
    "review_hint": "민원신청·동의·확인 단계 화면을 시나리오에 추가한 뒤 각 단계별 UX를 수동 점검하세요. (IPMS 로그인 후 auth 시나리오)",
    "guideline_version": "2025.08"
  },
  {
    "id": "UX-KRDS-5.3",
    "category": "uiux",
    "section": "서비스 패턴",
    "principle": "로그인",
    "title": "로그인·인증 UX",
    "description": "로그인 폼 레이블, 오류, 대체 수단 안내 등 KRDS 로그인 패턴",
    "automatable": "manual",
    "severity_default": "info",
    "runtime_checks": [],
    "static_checks": [],
    "kwcag_map": ["7.3.1"],
    "krds_ref": "KRDS · Service Pattern · 로그인",
    "ref_url": "https://www.krds.go.kr/html/site/service/service_03_05.html",
    "ref_fallback_url": "https://www.krds.go.kr/html/site/service/service_03_04.html",
    "fix_hint": "로그인 화면 state를 시나리오에 포함하고 레이블·오류·도움말을 수동 확인하세요.",
    "review_state_ids": ["login_form"],
    "review_hint": "시나리오 「로그인 화면 (login_form)」 캡처·화면에서 ID/PW 레이블, 오류 메시지, 대체 수단 안내를 확인하세요.",
    "guideline_version": "2025.08"
  },
  {
    "id": "UX-KRDS-6.1",
    "category": "uiux",
    "section": "UX 패턴",
    "principle": "반응형",
    "title": "모바일·반응형 viewport",
    "description": "모바일 기준 viewport meta 및 반응형 레이아웃",
    "automatable": "auto",
    "severity_default": "warning",
    "runtime_checks": ["viewport_meta"],
    "static_checks": ["viewport_meta_tag"],
    "kwcag_map": [],
    "krds_ref": "KRDS · Layout · Responsive",
    "ref_url": "https://www.krds.go.kr/html/site/style/style_05.html",
    "ref_text": "브레이크포인트",
    "ref_fallback_url": "https://www.krds.go.kr/html/site/style/style_01.html",
    "fix_hint": "<meta name=\"viewport\" content=\"width=device-width, initial-scale=1\"> 를 layout에 추가하세요.",
    "guideline_version": "2025.08"
  }
]
